Titre,Statut,Clé,Description,Kicker,Sous-titre,Quote,Page title,Quick links eyebrow,Legal left,Legal right,CTA label,CTA href,Contenu HTML
home-hero,Publié,home-hero,,,,"L'actualité du village, claire, utile et bien envoyée.",,,,,,,
Portail Citoyen,Publié,home-editorial,"Les actualités du village sont désormais consultables dans une page à part, pensée pour filtrer les contenus par rubrique et accéder directement aux informations utiles.",Page dédiée,,,,Accès rapide,,,,,
Des grandes catégories pour suivre la vie locale,Publié,home-rubriques,"Le site s’organise maintenant comme une édition locale : chaque rubrique a son ton, son rôle et son type d’actualité.",Rubriques de la semaine,,,,,,,,,
Stratégie de Diffusion,Publié,home-diffusion,,Modèle de circulation,,,,,,,,,
"Une édition locale, lisible et évolutive",Publié,footer,"La page fonctionne comme une couverture éditoriale : des rubriques stables, des sujets mis en avant et un portail que l’on peut enrichir à chaque nouvelle publication.",Le Journal d'Annet,,,,,© 2026 - Le Petit Journal d'Annet,Une initiative citoyenne pour renouer le dialogue,,,
